{
  "id": "soroban-internal-helper-missing-require-auth-fp-01",
  "issue_claim": "A Soroban internal helper function does not call require_auth directly, so any user can steal funds through it.",
  "why_it_looked_bad": "Soroban 敏感动作通常需要显式 require_auth；看到 helper 修改余额但没有授权检查容易被当成 High。",
  "why_not_valid": "如果该 helper 不是公开 entrypoint，且所有公开调用者已经对同一个被扣款/被 claim 的 Address 完成 require_auth，则 helper 内不重复授权本身不是漏洞。",
  "classification": "false-positive-or-needs-entrypoint-reachability",
  "downgrade_reason": "缺少公开可达路径或授权主体不一致证据时，只能作为审计检查项，不能直接报 Medium/High。",
  "trust_assumption": "所有 public contract entrypoints 的调用矩阵已覆盖，且 helper 不通过跨合约调用或 callback 暴露。",
  "when_it_could_be_real": [
    "存在另一个公开入口调用该 helper 但未对受害者 Address require_auth",
    "helper 使用 receiver/invoker 而不是 owner 作为授权主体",
    "跨合约 callback 或 flash-loan path 能绕过主入口授权"
  ],
  "source_url": "https://developers.stellar.org/docs/build/smart-contracts/overview",
  "tags": [
    "require-auth",
    "false-positive",
    "entrypoint-reachability",
    "soroban-rust",
    "stellar-rust"
  ]
}
